,accessionyear,technique,mediacount,edition,totalpageviews,groupcount,people,objectnumber,colorcount,lastupdate,rank,imagecount,description,dateoflastpageview,dateoffirstpageview,primaryimageurl,colors,dated,contextualtextcount,copyright,period,accessionmethod,url,provenance,images,publicationcount,objectid,culture,verificationleveldescription,standardreferencenumber,worktypes,department,state,markscount,contact,titlescount,id,title,verificationlevel,division,style,commentary,relatedcount,datebegin,labeltext,totaluniquepageviews,dimensions,exhibitioncount,techniqueid,dateend,creditline,imagepermissionlevel,signed,periodid,century,classificationid,medium,peoplecount,accesslevel,classification,seeAlso,details
0,,Daguerreotype,0,,657,1,"[{'alphasort': 'Southworth & Hawes', 'birthplace': None, 'name': 'Southworth & Hawes', 'prefix': None, 'personid': 28806, 'gender': 'unknown', 'role': 'Artist', 'displayorder': 1, 'culture': 'American', 'displaydate': 'active 1843-1863', 'deathplace': None, 'displayname': 'Southworth & Hawes'}]",9.1979,10,2020-02-20T05:43:01-0500,1,1,,2020-02-07,2009-06-23,https://nrs.harvard.edu/urn-3:HUAM:77631_dynmc,"[{'percent': 0.53710144927536, 'spectrum': '#1eb264', 'color': '#191919', 'css3': '#000000', 'hue': 'Grey'}, {'percent': 0.24828985507246, 'spectrum': '#2eb45d', 'color': '#323232', 'css3': '#2f4f4f', 'hue': 'Grey'}, {'percent': 0.12840579710145, 'spectrum': '#3db657', 'color': '#4b4b4b', 'css3': '#2f4f4f', 'hue': 'Grey'}, {'percent': 0.028811594202899, 'spectrum': '#7866ad', 'color': '#646464', 'css3': '#696969', 'hue': 'Grey'}, {'percent': 0.020985507246377, 'spectrum': '#59ba4a', 'color': '#644b32', 'css3': '#556b2f', 'hue': 'Brown'}, {'percent': 0.010260869565217, 'spectrum': '#8761aa', 'color': '#969696', 'css3': '#a9a9a9', 'hue': 'Grey'}, {'percent': 0.0099130434782609, 'spectrum': '#8362aa', 'color': '#7d7d7d', 'css3': '#808080', 'hue': 'Grey'}, {'percent': 0.0081159420289855, 'spectrum': '#8c5fa8', 'color': '#afafaf', 'css3': '#a9a9a9', 'hue': 'Grey'}, {'percent': 0.0054492753623188, 'spectrum': '#6cbd45', 'color': '#7d6432', 'css3': '#a0522d', 'hue': 'Yellow'}, {'percent': 0.0024347826086957, 'spectrum': '#b55592', 'color': '#c8c8af', 'css3': '#c0c0c0', 'hue': 'Green'}]",c. 1850-1856,0,,,,https://www.harvardartmuseums.org/collections/object/286193,,"[{'height': 2550, 'iiifbaseuri': 'https://ids.lib.harvard.edu/ids/iiif/17917078', 'baseimageurl': 'https://nrs.harvard.edu/urn-3:HUAM:77631_dynmc', 'width': 2009, 'publiccaption': None, 'idsid': 17917078, 'displayorder': 1, 'format': 'image/jpeg', 'copyright': 'President and Fellows of Harvard College', 'imageid': 24001, 'renditionnumber': '77631'}]",3,286193,American,Good. Object is well described and information is vetted,,"[{'worktypeid': '259', 'worktype': 'photograph'}]",Department of Photographs,,1,am_europeanamerican@harvard.edu,1,286193,John Collins Warren (1778-1856),3,European and American Art,,,0,1845,,534,actual: 20.5 x 15.5 cm (8 1/16 x 6 1/8 in.),2,1430.0,1856,"Harvard Art Museums/Fogg Museum, Loan from the Massachusetts General Hospital Archives and Special Collections",0,,,19th century,17,Whole plate daguerreotype,1,1,Photographs,"[{'id': 'https://iiif.harvardartmuseums.org/manifests/object/286193', 'type': 'IIIF Manifest', 'format': 'application/json', 'profile': 'http://iiif.io/api/presentation/2/context.json'}]",
1,2002.0,Lusterware,0,,804,2,,2002.50.72,10,2020-02-20T05:39:00-0500,2,2,"Repaired from about twenty fragments, but with only small losses, this bowl is decorated with two startled-looking animals— a rooster, and, in its beak, a fish. Their wide-eyed energy is sustained by other sharply angled elements of the design: fins and tail feathers, coxcomb, and fluttering scarf. These creatures have long carried positive associations: the rooster, as the harbinger of dawn, symbolizes hope, while the fish suggests bounty. In religious contexts, the rooster also developed more specifically auspicious connotations: according to a popular epigram attributed to the Prophet Muhammad, he crows when he sees an angel; in Christian tradition, his invigorating sound recalls the faltering to their faith. The glazed base of this bowl bears an undecipherable inscription in Kufic script.",2020-02-07,2009-06-18,https://nrs.harvard.edu/urn-3:HUAM:75485_dynmc,"[{'percent': 0.24529761904762, 'spectrum': '#e9715f', 'color': '#af9664', 'css3': '#bdb76b', 'hue': 'Yellow'}, {'percent': 0.23184523809524, 'spectrum': '#8c5fa8', 'color': '#afafaf', 'css3': '#a9a9a9', 'hue': 'Grey'}, {'percent': 0.15755952380952, 'spectrum': '#8761aa', 'color': '#969696', 'css3': '#a9a9a9', 'hue': 'Grey'}, {'percent': 0.14982142857143, 'spectrum': '#8362aa', 'color': '#7d7d7d', 'css3': '#808080', 'hue': 'Grey'}, {'percent': 0.12880952380952, 'spectrum': '#8c5fa8', 'color': '#c8c8c8', 'css3': '#c0c0c0', 'hue': 'Grey'}, {'percent': 0.054880952380952, 'spectrum': '#7fc241', 'color': '#967d4b', 'css3': '#a0522d', 'hue': 'Brown'}, {'percent': 0.012261904761905, 'spectrum': '#7866ad', 'color': '#646464', 'css3': '#696969', 'hue': 'Grey'}, {'percent': 0.011547619047619, 'spectrum': '#6cbd45', 'color': '#7d6432', 'css3': '#a0522d', 'hue': 'Yellow'}, {'percent': 0.0041071428571429, 'spectrum': '#59ba4a', 'color': '#644b32', 'css3': '#556b2f', 'hue': 'Brown'}, {'percent': 0.0028571428571429, 'spectrum': '#4ab851', 'color': '#4b3219', 'css3': '#556b2f', 'hue': 'Brown'}]",10th century,1,,Abbasid period,Gift,https://www.harvardartmuseums.org/collections/object/165491,"[Mansour Gallery, London, 1973], sold; to Stanford and Norma Jean Calderwood, Belmont, MA (1973-2002), gift; to Harvard Art Museums, 2002.
","[{'height': 1913, 'iiifbaseuri': 'https://ids.lib.harvard.edu/ids/iiif/18482588', 'baseimageurl': 'https://nrs.harvard.edu/urn-3:HUAM:75485_dynmc', 'width': 2550, 'publiccaption': None, 'idsid': 18482588, 'displayorder': 1, 'format': 'image/jpeg', 'copyright': 'President and Fellows of Harvard College', 'imageid': 35525, 'renditionnumber': '75485'}, {'height': 1558, 'iiifbaseuri': 'https://ids.lib.harvard.edu/ids/iiif/42759101', 'baseimageurl': 'https://nrs.harvard.edu/urn-3:huam:DDC112844_dynmc', 'width': 2550, 'publiccaption': 'side', 'idsid': 42759101, 'displayorder': 2, 'format': 'image/jpeg', 'copyright': None, 'imageid': 410153, 'renditionnumber': 'DDC112844'}]",2,165491,,Good. Object is well described and information is vetted,,"[{'worktypeid': '389', 'worktype': 'vessel'}]",Department of Islamic & Later Indian Art,,0,am_asianmediterranean@harvard.edu,1,165491,Bowl with Rooster and Fish,3,Asian and Mediterranean Art,,"Label text from exhibition “Re-View,” an overview of objects drawn from the collections of Harvard Art Museums, 26 April 2008 – 1 July 2013;  label text written by Mary McWilliams, Norma Jean Calderwood Curator of Islamic and Later Indian Art, Division of Asian and Mediterranean Art:

Bowl with Rooster Holding a Fish
Iraq, Basra, `Abbasid dynasty, late 9th–early 10th century
Earthenware with luster painted over glaze 
Arthur M. Sackler Museum, The Norma Jean Calderwood Collection of Islamic Art, 2002.50.72

One of the most significant innovations attributed to ninth-century potters working in Basra was the application of luster painting to ceramics. In this failure-prone technique, the artist painted a mixture of metal oxides onto an already fired and glazed surface. The vessel was then fired a second time in a kiln with a low-oxygen atmosphere. If all went right, the design was deposited on the glaze as an irides¬cent stain, imperceptible to the touch. Probably the costliest product of the Basra kilns, lusterware was widely exported and imitated. Knowledge of the luster technique gradually spread both eastward into Iran and westward as far as Spain.
",1,9,"Probably the costliest products of the Basra kilns, luster wares were widely exported and imitated. Knowledge of the luster technique gradually spread westward to Syria, Egypt, and Spain, and eastward into Iran. Early luster designs were typically bold and loosely painted, covering most of the vessel. Auspicious inscriptions or symbols were particularly popular. The creatures rendered here — a wide-eyed rooster and a fish — have long carried positive associations: as the harbinger of dawn, the rooster symbolizes hope, while the fish suggests bounty.",674,5.9 x 23.2 cm (2 5/16 x 9 1/8 in.),5,2341.0,9,"Harvard Art Museums/Arthur M. Sackler Museum, The Norma Jean Calderwood Collection of Islamic Art",0,,2497.0,10th century,57,Buff-colored earthenware painted with luster (silver and copper) over white lead alkali glaze opacified with tin,0,1,Vessels,"[{'id': 'https://iiif.harvardartmuseums.org/manifests/object/165491', 'type': 'IIIF Manifest', 'format': 'application/json', 'profile': 'http://iiif.io/api/presentation/2/context.json'}]",
2,1939.0,,0,,1152,2,"[{'alphasort': 'Homer, Winslow', 'birthplace': 'Boston, MA', 'name': 'Winslow Homer', 'prefix': None, 'personid': 26501, 'gender': 'male', 'role': 'Artist', 'displayorder': 1, 'culture': 'American', 'displaydate': '1836 - 1910', 'deathplace': 'Prouts Neck, ME', 'displayname': 'Winslow Homer'}]",1939.230,7,2020-02-20T05:43:47-0500,3,1,,2020-02-08,2009-05-21,https://nrs.harvard.edu/urn-3:HUAM:51339_dynmc,"[{'percent': 0.44615873015873, 'spectrum': '#3db657', 'color': '#4b4b4b', 'css3': '#2f4f4f', 'hue': 'Grey'}, {'percent': 0.31739682539683, 'spectrum': '#59ba4a', 'color': '#64644b', 'css3': '#696969', 'hue': 'Green'}, {'percent': 0.12825396825397, 'spectrum': '#6cbd45', 'color': '#7d7d64', 'css3': '#808080', 'hue': 'Yellow'}, {'percent': 0.047047619047619, 'spectrum': '#8e5ea7', 'color': '#96967d', 'css3': '#808080', 'hue': 'Green'}, {'percent': 0.029269841269841, 'spectrum': '#955ba5', 'color': '#e1e1e1', 'css3': '#dcdcdc', 'hue': 'Grey'}, {'percent': 0.019428571428571, 'spectrum': '#b55592', 'color': '#c8c8af', 'css3': '#c0c0c0', 'hue': 'Green'}, {'percent': 0.012444444444444, 'spectrum': '#8e5ea7', 'color': '#afaf96', 'css3': '#a9a9a9', 'hue': 'Green'}]",1892,0,,,Gift,https://www.harvardartmuseums.org/collections/object/307787,"Winslow Homer, sold [through Doll and Richards, Boston, 1892]; to Edward W. Hooper, Boston, 1892, bequest; to his brother-in-law Horace D. Chapin, Boston, circa 1911, gift; to his sister, Mrs. Robert B. Osgood, Boston, 1937, gift; to Fogg Art Museum, 1939
","[{'height': 1761, 'iiifbaseuri': 'https://ids.lib.harvard.edu/ids/iiif/17386629', 'baseimageurl': 'https://nrs.harvard.edu/urn-3:HUAM:51339_dynmc', 'width': 2550, 'publiccaption': None, 'idsid': 17386629, 'displayorder': 1, 'format': 'image/jpeg', 'copyright': 'President and Fellows of Harvard College', 'imageid': 131263, 'renditionnumber': '51339'}]",36,307787,American,"Best. Object is extensively researched, well described and information is vetted",,"[{'worktypeid': '125', 'worktype': 'drawing'}]",Department of Drawings,,2,am_europeanamerican@harvard.edu,2,307787,Hunter in the Adirondacks,4,European and American Art,,,0,1892,,980,35.2 x 50.7 cm (13 7/8 x 19 15/16 in.),17,,1892,"Harvard Art Museums/Fogg Museum, Anonymous Gift",0,"blue watercolor, l.r.: 1892/ HOMER",,19th century,21,Watercolor over graphite on white paper,1,1,Drawings,"[{'id': 'https://iiif.harvardartmuseums.org/manifests/object/307787', 'type': 'IIIF Manifest', 'format': 'application/json', 'profile': 'http://iiif.io/api/presentation/2/context.json'}]",
3,2006.0,,0,,524,2,"[{'alphasort': 'Peale, Raphaelle', 'birthplace': 'Annapolis, MD', 'name': 'Raphaelle Peale', 'prefix': None, 'personid': 50769, 'gender': 'male', 'role': 'Artist', 'displayorder': 1, 'culture': 'American', 'displaydate': '1774 - 1825', 'deathplace': 'Philadelphia, PA', 'displayname': 'Raphaelle Peale'}]",2006.192,10,2020-02-20T05:44:09-0500,4,2,,2020-02-09,2009-06-24,https://nrs.harvard.edu/urn-3:HUAM:DDC103481_dynmc,"[{'percent': 0.63716417910448, 'spectrum': '#2eb45d', 'color': '#323232', 'css3': '#2f4f4f', 'hue': 'Grey'}, {'percent': 0.10024875621891, 'spectrum': '#1eb264', 'color': '#191919', 'css3': '#000000', 'hue': 'Grey'}, {'percent': 0.058507462686567, 'spectrum': '#3db657', 'color': '#4b4b4b', 'css3': '#2f4f4f', 'hue': 'Grey'}, {'percent': 0.056517412935323, 'spectrum': '#59ba4a', 'color': '#644b32', 'css3': '#556b2f', 'hue': 'Brown'}, {'percent': 0.044726368159204, 'spectrum': '#8c5fa8', 'color': '#afafaf', 'css3': '#a9a9a9', 'hue': 'Grey'}, {'percent': 0.030746268656716, 'spectrum': '#59ba4a', 'color': '#64644b', 'css3': '#696969', 'hue': 'Green'}, {'percent': 0.023333333333333, 'spectrum': '#8e5ea7', 'color': '#96967d', 'css3': '#808080', 'hue': 'Green'}, {'percent': 0.018308457711443, 'spectrum': '#6cbd45', 'color': '#7d7d64', 'css3': '#808080', 'hue': 'Yellow'}, {'percent': 0.016616915422886, 'spectrum': '#b55592', 'color': '#c8c8af', 'css3': '#c0c0c0', 'hue': 'Green'}, {'percent': 0.0056716417910448, 'spectrum': '#6cbd45', 'color': '#7d6432', 'css3': '#a0522d', 'hue': 'Yellow'}]",c. 1800-1810,0,,,Purchase,https://www.harvardartmuseums.org/collections/object/317736,"Private collection; with Angela Einstein, Cambridge, MA, 2006.","[{'height': 2550, 'iiifbaseuri': 'https://ids.lib.harvard.edu/ids/iiif/20029186', 'baseimageurl': 'https://nrs.harvard.edu/urn-3:HUAM:DDC103481_dynmc', 'width': 2251, 'publiccaption': None, 'idsid': 20029186, 'displayorder': 1, 'format': 'image/jpeg', 'copyright': 'President and Fellows of Harvard College', 'imageid': 259070, 'renditionnumber': 'DDC103481'}, {'height': 2455, 'iiifbaseuri': 'https://ids.lib.harvard.edu/ids/iiif/20414743', 'baseimageurl': 'https://nrs.harvard.edu/urn-3:HUAM:INV119263_dynmc', 'width': 2193, 'publiccaption': None, 'idsid': 20414743, 'displayorder': 2, 'format': 'image/jpeg', 'copyright': 'President and Fellows of Harvard College', 'imageid': 208201, 'renditionnumber': 'INV119263'}]",2,317736,American,"Best. Object is extensively researched, well described and information is vetted",,"[{'worktypeid': '242', 'worktype': 'painting'}]","Department of American Paintings, Sculpture & Decorative Arts",,0,am_europeanamerican@harvard.edu,1,317736,Perry Albert Cohea,4,European and American Art,,,0,1795,,454,7 x 5.5 cm (2 3/4 x 2 3/16 in.),3,,1810,"Harvard Art Museums/Fogg Museum, Daniel A. Pollack, Class of 1960, American Art Acquisition Fund",0,r.c.: R. Peale,,19th century,26,Watercolor on ivory,1,1,Paintings,"[{'id': 'https://iiif.harvardartmuseums.org/manifests/object/317736', 'type': 'IIIF Manifest', 'format': 'application/json', 'profile': 'http://iiif.io/api/presentation/2/context.json'}]",
4,,Etching and drypoint,0,,554,1,"[{'alphasort': 'Rembrandt Harmensz. van Rijn', 'birthplace': 'Leiden', 'name': 'Rembrandt Harmensz. van Rijn', 'prefix': None, 'personid': 28241, 'gender': 'male', 'role': 'Artist', 'displayorder': 1, 'culture': 'Dutch', 'displaydate': '1606 - 1669', 'deathplace': 'Amsterdam', 'displayname': 'Rembrandt Harmensz. van Rijn'}]",G6753,7,2020-02-20T05:42:51-0500,5,1,,2020-02-09,2011-01-07,https://nrs.harvard.edu/urn-3:HUAM:INV191941_dynmc,"[{'percent': 0.42054644808743, 'spectrum': '#e66c64', 'color': '#c8af96', 'css3': '#d2b48c', 'hue': 'Brown'}, {'percent': 0.27158469945355, 'spectrum': '#b55592', 'color': '#c8c8af', 'css3': '#c0c0c0', 'hue': 'Green'}, {'percent': 0.14262295081967, 'spectrum': '#c25687', 'color': '#af967d', 'css3': '#bc8f8f', 'hue': 'Brown'}, {'percent': 0.067540983606557, 'spectrum': '#b65590', 'color': '#967d64', 'css3': '#808080', 'hue': 'Brown'}, {'percent': 0.050928961748634, 'spectrum': '#e9715f', 'color': '#e1e1c8', 'css3': '#dcdcdc', 'hue': 'Green'}, {'percent': 0.034535519125683, 'spectrum': '#b25593', 'color': '#7d644b', 'css3': '#696969', 'hue': 'Yellow'}, {'percent': 0.01224043715847, 'spectrum': '#4ab851', 'color': '#4b4b32', 'css3': '#556b2f', 'hue': 'Green'}]",1651,0,,,,https://www.harvardartmuseums.org/collections/object/279265,,"[{'height': 1038, 'iiifbaseuri': 'https://ids.lib.harvard.edu/ids/iiif/20456770', 'baseimageurl': 'https://nrs.harvard.edu/urn-3:HUAM:INV191941_dynmc', 'width': 2550, 'publiccaption': None, 'idsid': 20456770, 'displayorder': 1, 'format': 'image/jpeg', 'copyright': 'President and Fellows of Harvard College', 'imageid': 308341, 'renditionnumber': 'INV191941'}]",1,279265,Dutch,Good. Object is well described and information is vetted,"New Hollstein 257, Bartsch 234; Hind 249, Rovinski 234","[{'worktypeid': '278', 'worktype': 'print'}]",Department of Prints,only state,7,am_europeanamerican@harvard.edu,1,279265,"Panorama near Bloemendael Showing the Saxenburg Estate (""The Goldweigher's Field"")",3,European and American Art,,,0,1651,,473,"sheet: 12.8 x 32.7 cm (5 1/16 x 12 7/8 in.)
plate: 12.1 x 31.9 cm (4 3/4 x 12 9/16 in.)",3,1205.0,1651,"Harvard Art Museums/Fogg Museum, Gray Collection of Engravings Fund",0,Rembrandt.,,17th century,23,"Etching and drypoint with light plate tone, with touches of gray wash in some drypoint areas, on off-white antique laid paper",1,1,Prints,"[{'id': 'https://iiif.harvardartmuseums.org/manifests/object/279265', 'type': 'IIIF Manifest', 'format': 'application/json', 'profile': 'http://iiif.io/api/presentation/2/context.json'}]",
5,1984.0,,0,,629,2,,1984.502,0,2020-02-20T05:36:50-0500,6,1,,2020-02-09,2010-10-13,https://nrs.harvard.edu/urn-3:HUAM:76710_dynmc,,19th century,0,,,Gift,https://www.harvardartmuseums.org/collections/object/54045,,"[{'height': 1614, 'iiifbaseuri': 'https://ids.lib.harvard.edu/ids/iiif/17825998', 'baseimageurl': 'https://nrs.harvard.edu/urn-3:HUAM:76710_dynmc', 'width': 2550, 'publiccaption': 'Set of four palm-leaf manuscripts', 'idsid': 17825998, 'displayorder': 1, 'format': 'image/jpeg', 'copyright': 'President and Fellows of Harvard College', 'imageid': 35817, 'renditionnumber': '76710'}]",0,54045,Thai,Unchecked. Object information has not been verified for completeness and has not been vetted,,"[{'worktypeid': '208', 'worktype': 'manuscript'}]",Department of Asian Art,,0,am_asianmediterranean@harvard.edu,1,54045,Illustrated Buddhist Text (in Khmer script),0,Asian and Mediterranean Art,,,4,1800,,542,,0,,1899,"Harvard Art Museums/Arthur M. Sackler Museum, Gift of Philip Hofer",0,,,19th century,185,,0,1,Manuscripts,"[{'id': 'https://iiif.harvardartmuseums.org/manifests/object/54045', 'type': 'IIIF Manifest', 'format': 'application/json', 'profile': 'http://iiif.io/api/presentation/2/context.json'}]",
