,accessionyear,technique,mediacount,edition,totalpageviews,groupcount,people,objectnumber,colorcount,lastupdate,rank,imagecount,description,dateoflastpageview,dateoffirstpageview,primaryimageurl,colors,dated,contextualtextcount,copyright,period,accessionmethod,url,provenance,images,publicationcount,objectid,culture,verificationleveldescription,standardreferencenumber,worktypes,department,state,markscount,contact,titlescount,id,title,verificationlevel,division,style,commentary,relatedcount,datebegin,labeltext,totaluniquepageviews,dimensions,exhibitioncount,techniqueid,dateend,creditline,imagepermissionlevel,signed,periodid,century,classificationid,medium,peoplecount,accesslevel,classification,seeAlso,details
12,2000.0,Engraving,0,,1062,2,"[{'alphasort': 'Dürer, Albrecht', 'birthplace': 'Nuremberg', 'name': 'Albrecht Dürer', 'prefix': None, 'personid': 18947, 'gender': 'male', 'role': 'Artist', 'displayorder': 1, 'culture': 'German', 'displaydate': '1471 - 1528', 'deathplace': 'Nuremberg', 'displayname': 'Albrecht Dürer'}]",M24944,7,2020-02-20T05:41:21-0500,13,1,,2020-02-09,2009-08-14,https://nrs.harvard.edu/urn-3:HUAM:DDC103414_dynmc,"[{'percent': 0.40814102564103, 'spectrum': '#8c5fa8', 'color': '#c8c8c8', 'css3': '#c0c0c0', 'hue': 'Grey'}, {'percent': 0.14358974358974, 'spectrum': '#8761aa', 'color': '#969696', 'css3': '#a9a9a9', 'hue': 'Grey'}, {'percent': 0.12525641025641, 'spectrum': '#8c5fa8', 'color': '#afafaf', 'css3': '#a9a9a9', 'hue': 'Grey'}, {'percent': 0.12435897435897, 'spectrum': '#8362aa', 'color': '#7d7d7d', 'css3': '#808080', 'hue': 'Grey'}, {'percent': 0.095512820512821, 'spectrum': '#7866ad', 'color': '#646464', 'css3': '#696969', 'hue': 'Grey'}, {'percent': 0.075769230769231, 'spectrum': '#3db657', 'color': '#4b4b4b', 'css3': '#2f4f4f', 'hue': 'Grey'}, {'percent': 0.027371794871795, 'spectrum': '#2eb45d', 'color': '#323232', 'css3': '#2f4f4f', 'hue': 'Grey'}]",c. 1502,0,,,Gift,https://www.harvardartmuseums.org/collections/object/233069,,"[{'height': 2550, 'iiifbaseuri': 'https://ids.lib.harvard.edu/ids/iiif/20029120', 'baseimageurl': 'https://nrs.harvard.edu/urn-3:HUAM:DDC103414_dynmc', 'width': 1784, 'publiccaption': None, 'idsid': 20029120, 'displayorder': 1, 'format': 'image/jpeg', 'copyright': 'President and Fellows of Harvard College', 'imageid': 257843, 'renditionnumber': 'DDC103414'}]",2,233069,German,Good. Object is well described and information is vetted,H. 72; B. 77,"[{'worktypeid': '278', 'worktype': 'print'}]",Department of Prints,,0,am_europeanamerican@harvard.edu,2,233069,Nemesis,3,European and American Art,,,0,1497,,835,sheet: 32.6 × 22.4 cm (12 13/16 × 8 13/16 in.),2,98.0,1507,"Harvard Art Museums/Fogg Museum, Gift of Marjorie B. Cohn in honor of Jakob Rosenberg",0,Monogram A D,,16th century,23,Engraving on cream antique laid paper,1,1,Prints,"[{'id': 'https://iiif.harvardartmuseums.org/manifests/object/233069', 'type': 'IIIF Manifest', 'format': 'application/json', 'profile': 'http://iiif.io/api/presentation/2/context.json'}]",
13,,Engraving,0,,551,1,"[{'alphasort': 'Dürer, Albrecht', 'birthplace': 'Nuremberg', 'name': 'Albrecht Dürer', 'prefix': None, 'personid': 18947, 'gender': 'male', 'role': 'Artist', 'displayorder': 1, 'culture': 'German', 'displaydate': '1471 - 1528', 'deathplace': 'Nuremberg', 'displayname': 'Albrecht Dürer'}]",G6756,8,2020-02-20T05:43:29-0500,14,1,,2020-02-10,2010-02-28,https://nrs.harvard.edu/urn-3:HUAM:LEG991_dynmc,"[{'percent': 0.26373831775701, 'spectrum': '#955ba5', 'color': '#e1e1e1', 'css3': '#dcdcdc', 'hue': 'Grey'}, {'percent': 0.18, 'spectrum': '#2eb45d', 'color': '#323232', 'css3': '#2f4f4f', 'hue': 'Grey'}, {'percent': 0.13233644859813, 'spectrum': '#1eb264', 'color': '#191919', 'css3': '#000000', 'hue': 'Grey'}, {'percent': 0.12959501557632, 'spectrum': '#3db657', 'color': '#4b4b4b', 'css3': '#2f4f4f', 'hue': 'Grey'}, {'percent': 0.10448598130841, 'spectrum': '#7866ad', 'color': '#646464', 'css3': '#696969', 'hue': 'Grey'}, {'percent': 0.083052959501558, 'spectrum': '#8362aa', 'color': '#7d7d7d', 'css3': '#808080', 'hue': 'Grey'}, {'percent': 0.059314641744548, 'spectrum': '#8c5fa8', 'color': '#afafaf', 'css3': '#a9a9a9', 'hue': 'Grey'}, {'percent': 0.047476635514019, 'spectrum': '#8761aa', 'color': '#969696', 'css3': '#a9a9a9', 'hue': 'Grey'}]",1505,0,,,,https://www.harvardartmuseums.org/collections/object/299824,"Walter Francis, fifth Duke of Buccleuch, London and Dalkeith, Scotland (402), Collector, sold at Christie's, 1887. Sale, 9-22 April 1887.
G. B. Maggi, Turin, Italy (1776), 1855.
","[{'height': 1024, 'iiifbaseuri': 'https://ids.lib.harvard.edu/ids/iiif/43162542', 'baseimageurl': 'https://nrs.harvard.edu/urn-3:HUAM:LEG991_dynmc', 'width': 735, 'publiccaption': None, 'idsid': 43162542, 'displayorder': 1, 'format': 'image/jpeg', 'copyright': 'President and Fellows of Harvard College', 'imageid': 162863, 'renditionnumber': 'LEG991'}]",0,299824,German,Good. Object is well described and information is vetted,B. 97,"[{'worktypeid': '278', 'worktype': 'print'}]",Department of Prints,,0,am_europeanamerican@harvard.edu,1,299824,The Large Horse,3,European and American Art,,,0,1505,,500,sheet: 16.7 x 11.8 cm (6 9/16 x 4 5/8 in.),0,98.0,1505,"Harvard Art Museums/Fogg Museum, Gray Collection of Engravings Fund",0,AD,,16th century,23,,1,1,Prints,"[{'id': 'https://iiif.harvardartmuseums.org/manifests/object/299824', 'type': 'IIIF Manifest', 'format': 'application/json', 'profile': 'http://iiif.io/api/presentation/2/context.json'}]",
14,1997.0,Gelatin silver print,0,,770,2,"[{'alphasort': 'Degas, Hilaire-Germain-Edgar', 'birthplace': 'Paris, France', 'name': 'Hilaire-Germain-Edgar Degas', 'prefix': None, 'personid': 35055, 'gender': 'male', 'role': 'Artist', 'displayorder': 1, 'culture': 'French', 'displaydate': '1834 - 1917', 'deathplace': 'Paris, France', 'displayname': 'Hilaire-Germain-Edgar Degas'}]",P1997.42,7,2020-02-20T05:39:15-0500,15,3,,2020-02-10,2009-06-04,https://nrs.harvard.edu/urn-3:HUAM:78366_dynmc,"[{'percent': 0.59213836477987, 'spectrum': '#3db657', 'color': '#4b4b4b', 'css3': '#2f4f4f', 'hue': 'Grey'}, {'percent': 0.30176100628931, 'spectrum': '#7866ad', 'color': '#646464', 'css3': '#696969', 'hue': 'Grey'}, {'percent': 0.032201257861635, 'spectrum': '#6cbd45', 'color': '#7d7d64', 'css3': '#808080', 'hue': 'Yellow'}, {'percent': 0.029433962264151, 'spectrum': '#955ba5', 'color': '#e1e1e1', 'css3': '#dcdcdc', 'hue': 'Grey'}, {'percent': 0.016163522012579, 'spectrum': '#8c5fa8', 'color': '#c8c8c8', 'css3': '#c0c0c0', 'hue': 'Grey'}, {'percent': 0.014276729559748, 'spectrum': '#8e5ea7', 'color': '#96967d', 'css3': '#808080', 'hue': 'Green'}, {'percent': 0.014025157232704, 'spectrum': '#8e5ea7', 'color': '#afaf96', 'css3': '#a9a9a9', 'hue': 'Green'}]",Probably autumn 1895,0,,,Purchase,https://www.harvardartmuseums.org/collections/object/173196,"Massachusetts Audubon Society, Lincoln, Massachusetts, gift from Agnes Mongan, 1997, sold to Harvard University Art Museums, 1997.
Agnes Mongan, Cambridge, MA, from Paul Sachs?, gift to Massachusetts Audubon Society, Lincoln, , 1997.
","[{'height': 728, 'iiifbaseuri': 'https://ids.lib.harvard.edu/ids/iiif/18204583', 'baseimageurl': 'https://nrs.harvard.edu/urn-3:HUAM:78366_dynmc', 'width': 1024, 'publiccaption': None, 'idsid': 18204583, 'displayorder': 1, 'format': 'image/jpeg', 'copyright': 'President and Fellows of Harvard College', 'imageid': 134843, 'renditionnumber': '78366'}, {'height': 722, 'iiifbaseuri': 'https://ids.lib.harvard.edu/ids/iiif/43181890', 'baseimageurl': 'https://nrs.harvard.edu/urn-3:HUAM:20044_dynmc', 'width': 1024, 'publiccaption': None, 'idsid': 43181890, 'displayorder': 2, 'format': 'image/jpeg', 'copyright': 'President and Fellows of Harvard College', 'imageid': 6756, 'renditionnumber': '20044'}, {'height': 721, 'iiifbaseuri': 'https://ids.lib.harvard.edu/ids/iiif/17825802', 'baseimageurl': 'https://nrs.harvard.edu/urn-3:HUAM:76466_dynmc', 'width': 1024, 'publiccaption': None, 'idsid': 17825802, 'displayorder': 3, 'format': 'image/jpeg', 'copyright': 'President and Fellows of Harvard College', 'imageid': 35767, 'renditionnumber': '76466'}]",9,173196,French,Good. Object is well described and information is vetted,,"[{'worktypeid': '259', 'worktype': 'photograph'}]",Department of Photographs,,0,am_europeanamerican@harvard.edu,1,173196,Untitled (self-portrait in library),3,European and American Art,,,0,1895,,624,image: 11.9 x 16.7 cm (4 11/16 x 6 9/16 in.),3,123.0,1895,"Harvard Art Museums/Fogg Museum, Richard and Ronay Menschel Fund for the Acquisition of Photographs",0,,,19th century,17,Gelatin silver print,1,1,Photographs,"[{'id': 'https://iiif.harvardartmuseums.org/manifests/object/173196', 'type': 'IIIF Manifest', 'format': 'application/json', 'profile': 'http://iiif.io/api/presentation/2/context.json'}]",
15,1999.0,,0,,788,3,"[{'alphasort': 'Saftleven, Herman', 'birthplace': 'Rotterdam, Netherlands', 'name': 'Herman Saftleven', 'prefix': None, 'personid': 28454, 'gender': 'male', 'role': 'Artist', 'displayorder': 1, 'culture': 'Dutch', 'displaydate': '1609 - 1685', 'deathplace': 'Utrecht, Netherlands', 'displayname': 'Herman Saftleven'}]",1999.169,10,2020-02-20T05:40:05-0500,16,1,,2020-02-10,2010-02-03,https://nrs.harvard.edu/urn-3:HUAM:71920_dynmc,"[{'percent': 0.70465517241379, 'spectrum': '#e76d63', 'color': '#fae1e1', 'css3': '#ffe4e1', 'hue': 'Red'}, {'percent': 0.075574712643678, 'spectrum': '#e9715f', 'color': '#e1c8af', 'css3': '#f5deb3', 'hue': 'Orange'}, {'percent': 0.043908045977011, 'spectrum': '#6cbd45', 'color': '#7d7d64', 'css3': '#808080', 'hue': 'Yellow'}, {'percent': 0.041896551724138, 'spectrum': '#8e5ea7', 'color': '#96967d', 'css3': '#808080', 'hue': 'Green'}, {'percent': 0.033275862068966, 'spectrum': '#59ba4a', 'color': '#64644b', 'css3': '#696969', 'hue': 'Green'}, {'percent': 0.026206896551724, 'spectrum': '#8e5ea7', 'color': '#afaf96', 'css3': '#a9a9a9', 'hue': 'Green'}, {'percent': 0.024080459770115, 'spectrum': '#4ab851', 'color': '#4b4b32', 'css3': '#556b2f', 'hue': 'Green'}, {'percent': 0.021666666666667, 'spectrum': '#b25593', 'color': '#7d324b', 'css3': '#a52a2a', 'hue': 'Red'}, {'percent': 0.0097126436781609, 'spectrum': '#b65590', 'color': '#964b64', 'css3': '#696969', 'hue': 'Red'}, {'percent': 0.0089080459770115, 'spectrum': '#2eb45d', 'color': '#323232', 'css3': '#2f4f4f', 'hue': 'Grey'}]",1680,0,,,Gift,https://www.harvardartmuseums.org/collections/object/199108,"Agneta Block, Vijverhof, The Netherlands. Perhaps Samuel van Huls, The Hague, sold; [Swart, The Hague, 14 May 1736, under portfs. YYY and ZZZ, lot 3882.]  Perhaps Jan Bisschop, sold; [Bosch et al., Rotterdam, 24 June 1771, kb K, under lots 70-89]; lots 70-72, 75-78, 81-84, and 89 to H. van den Bergh, lots 73-74, 79-80, 85-86, and 88 to D. de Jongh, lot 87 to Fouquet.  Perhaps heirs of Michiel van den Bergh, Rotterdam, sold; [Holsteyn, Rotterdam, 19 June 1786, kb D, lots 4, 14-26]; to Philippie. Or instead perhaps the heirs of Daniel de Jongh, sold; [Van Ryp, Rotterdam, 26 March 1810, kb N, lots 55-61.]  Janet and John E. Marqusee, New York, sold; [Sotheby’s, London, 13 December 1973, lot 155, repr. p. 82]; to [Baskett & Day, London], sold; to Maida and George Abrams, Boston, 1974 (L. 3306, verso, lower left); The Maida and George Abrams Collection, 1999.169.
","[{'height': 2550, 'iiifbaseuri': 'https://ids.lib.harvard.edu/ids/iiif/18481425', 'baseimageurl': 'https://nrs.harvard.edu/urn-3:HUAM:71920_dynmc', 'width': 1999, 'publiccaption': None, 'idsid': 18481425, 'displayorder': 1, 'format': 'image/jpeg', 'copyright': 'President and Fellows of Harvard College', 'imageid': 21519, 'renditionnumber': '71920'}]",12,199108,Dutch,Good. Object is well described and information is vetted,,"[{'worktypeid': '125', 'worktype': 'drawing'}]",Department of Drawings,,8,am_europeanamerican@harvard.edu,1,199108,Mullein Pink,3,European and American Art,,,0,1680,,673,20 x 15.7 cm (7 7/8 x 6 3/16 in.),5,,1680,"The Maida and George Abrams Collection, Fogg Art Museum, Harvard University, Cambridge, Massachusetts",0,"Lower left, brown ink, HS. [in ligature] f. 1680",,17th century,21,"Transparent and opaque watercolor and brown ink over graphite, some glazing in green areas, on cream antique laid paper",1,1,Drawings,"[{'id': 'https://iiif.harvardartmuseums.org/manifests/object/199108', 'type': 'IIIF Manifest', 'format': 'application/json', 'profile': 'http://iiif.io/api/presentation/2/context.json'}]",
16,2002.0,,0,,862,2,"[{'alphasort': ""Haydar 'Ali"", 'birthplace': None, 'name': ""Haydar 'Ali"", 'prefix': None, 'personid': 23188, 'gender': 'unknown', 'role': 'Artist', 'displayorder': 1, 'culture': 'Persian', 'displaydate': None, 'deathplace': None, 'displayname': ""Haydar 'Ali""}]",2002.50.110,0,2020-02-20T05:38:29-0500,17,6,"On the dark brown upper surface of this pen case, European portrait roundels of a man and a woman are separated by three bird-and- flower vignettes. These unite different flora, with the rose predominating at the center, its branching stem inhabited by a solitary red-crested bird and insects fluttering around it. Haydar Ali’s signature  and the date of production appear in miniature white script in the spaces between the central bird-and- flower grouping and the flanking portraits. To add texture, the artist has used a technique combining wash and stippling in fine dots of pigment. The long sides of the pen case continue the bird- and- flower theme, expanding the botanical repertoire to include carnations, hazelnuts, and tulips. There are occasional, and presumably intentional, instances of visual ambiguity where what appear to be plants and flowers could be interpreted as insects. The base is painted in a solid red pigment with an overlying elegant scroll of flowers and palmettes executed in gold. The outer body of the extractable drawer follows the pattern of the base, while its end, built up to be flush with the surface of the outer case when the drawer is closed, is decorated with daisies, poppies, and an iris. The unadorned inner surface of the case reveals the method of construction through many layers of paper glued one upon another. A single word, muhkam (robust, strong), written at an indeterminate time, attests the physical integrity of the object. Haydar Ali, son of Muhammad Ismail, was active in the 1860s and 1870s and worked in the style of Najaf Ali. Several works signed by him are known.",2020-02-10,2009-11-06,https://nrs.harvard.edu/urn-3:HUAM:71498_dynmc,,1873-74 (H. 1290),1,,Qajar period,Gift,https://www.harvardartmuseums.org/collections/object/148152,"[Hadji Baba Rabbi House of Antiquities, Teheran, 1973], sold; to Stanford and Norma Jean Calderwood, Belmont, MA (1973-2002), gift; to Harvard Art Museums, 2002.","[{'height': 1130, 'iiifbaseuri': 'https://ids.lib.harvard.edu/ids/iiif/18481077', 'baseimageurl': 'https://nrs.harvard.edu/urn-3:HUAM:71498_dynmc', 'width': 2550, 'publiccaption': 'top', 'idsid': 18481077, 'displayorder': 1, 'format': 'image/jpeg', 'copyright': 'President and Fellows of Harvard College', 'imageid': 57113, 'renditionnumber': '71498'}, {'height': 392, 'iiifbaseuri': 'https://ids.lib.harvard.edu/ids/iiif/43053232', 'baseimageurl': 'https://nrs.harvard.edu/urn-3:huam:DDC113856_dynmc', 'width': 1024, 'publiccaption': 'side', 'idsid': 43053232, 'displayorder': 2, 'format': 'image/jpeg', 'copyright': None, 'imageid': 410656, 'renditionnumber': 'DDC113856'}, {'height': 316, 'iiifbaseuri': 'https://ids.lib.harvard.edu/ids/iiif/18481078', 'baseimageurl': 'https://nrs.harvard.edu/urn-3:HUAM:71499_dynmc', 'width': 1024, 'publiccaption': 'side', 'idsid': 18481078, 'displayorder': 3, 'format': 'image/jpeg', 'copyright': 'President and Fellows of Harvard College', 'imageid': 21437, 'renditionnumber': '71499'}, {'height': 946, 'iiifbaseuri': 'https://ids.lib.harvard.edu/ids/iiif/18481079', 'baseimageurl': 'https://nrs.harvard.edu/urn-3:HUAM:71500_dynmc', 'width': 1024, 'publiccaption': 'detail of signature', 'idsid': 18481079, 'displayorder': 4, 'format': 'image/jpeg', 'copyright': 'President and Fellows of Harvard College', 'imageid': 21438, 'renditionnumber': '71500'}, {'height': 716, 'iiifbaseuri': 'https://ids.lib.harvard.edu/ids/iiif/18481080', 'baseimageurl': 'https://nrs.harvard.edu/urn-3:HUAM:71501_dynmc', 'width': 1024, 'publiccaption': 'detail of date', 'idsid': 18481080, 'displayorder': 5, 'format': 'image/jpeg', 'copyright': 'President and Fellows of Harvard College', 'imageid': 21439, 'renditionnumber': '71501'}, {'height': 328, 'iiifbaseuri': 'https://ids.lib.harvard.edu/ids/iiif/18481291', 'baseimageurl': 'https://nrs.harvard.edu/urn-3:HUAM:71758_dynmc', 'width': 1024, 'publiccaption': None, 'idsid': 18481291, 'displayorder': 6, 'format': 'image/jpeg', 'copyright': 'President and Fellows of Harvard College', 'imageid': 57180, 'renditionnumber': '71758'}]",2,148152,,Good. Object is well described and information is vetted,,"[{'worktypeid': '252', 'worktype': 'pen box'}]",Department of Islamic & Later Indian Art,,0,am_asianmediterranean@harvard.edu,1,148152,"Pen Box with Flowers, Birds, and Portraits",3,Asian and Mediterranean Art,,,0,1873,,696,4 x 21.7 x 3.3 cm (1 9/16 x 8 9/16 x 1 5/16 in.),2,,1874,"Harvard Art Museums/Arthur M. Sackler Museum, The Norma Jean Calderwood Collection of Islamic Art",0,,3951.0,19th century,97,Opaque and semi-opaque watercolor on prepared pasteboard under shellac varnish,1,1,Artists' Tools,"[{'id': 'https://iiif.harvardartmuseums.org/manifests/object/148152', 'type': 'IIIF Manifest', 'format': 'application/json', 'profile': 'http://iiif.io/api/presentation/2/context.json'}]",
17,,,0,,877,1,,2003.291,0,2020-02-20T05:37:00-0500,18,2,"Large, broad-shouldered, narrow-waisted jars of this type were popular in Korea in the late seventeenth, eighteenth, and nineteenth centuries. Seventeenth- and eighteenth-century examples have a short, collarlike neck and an exaggerated profile, with bulging shoulders and a constricted waist; nineteenth-century examples, by contrast, show a more subdued profile but have a tall neck and a beveled foot. 

In the East Asian dualistic yin-yang interpretation of the universe, the dragon symbolizes the yang, or male, principle, while the phoenix represents the yin, or female, principle. Associated with water, the auspicious dragon is typically paired with clouds, mist, or rolling waves; the flaming jewel, borrowed from the repertory of Buddhist art, symbolizes transcendent wisdom. The motif here of a dragon chasing a flaming jewel thus symbolizes the pursuit of wisdom.
",2020-02-10,2009-06-07,https://nrs.harvard.edu/urn-3:HUAM:VRS53926_dynmc,,mid 18th century,0,,"Chosŏn dynasty, 1392-1910",,https://www.harvardartmuseums.org/collections/object/70504,"Marie-Hélène, New York (by 2003), gift; to Harvard University Art Museums, 2003.","[{'height': 2550, 'iiifbaseuri': 'https://ids.lib.harvard.edu/ids/iiif/20682921', 'baseimageurl': 'https://nrs.harvard.edu/urn-3:HUAM:VRS53926_dynmc', 'width': 2021, 'publiccaption': 'front', 'idsid': 20682921, 'displayorder': 1, 'format': 'image/jpeg', 'copyright': None, 'imageid': 53586, 'renditionnumber': '53926'}, {'height': 2550, 'iiifbaseuri': 'https://ids.lib.harvard.edu/ids/iiif/20682920', 'baseimageurl': 'https://nrs.harvard.edu/urn-3:HUAM:VRS53925_dynmc', 'width': 2021, 'publiccaption': 'back', 'idsid': 20682920, 'displayorder': 2, 'format': 'image/jpeg', 'copyright': None, 'imageid': 53585, 'renditionnumber': '53925'}]",2,70504,Korean,Good. Object is well described and information is vetted,,"[{'worktypeid': '389', 'worktype': 'vessel'}]",Department of Asian Art,,0,am_asianmediterranean@harvard.edu,1,70504,"Large, Broad-Shouldered Jar with Decoration of Two Striding Dragons, Each Pursuing a Flaming Jewel",3,Asian and Mediterranean Art,,,0,1735,,768,H. 44.3 x Diam. 35 cm (17 7/16 x 13 3/4 in.),2,,1735,"Harvard Art Museums/Arthur M. Sackler Museum, Gift of Marie-Hélène Weill and Claudia Weill Teller",0,,504.0,18th century,57,Blue-and-white ware: porcelain with decoration painted in underglaze cobalt blue,0,1,Vessels,"[{'id': 'https://iiif.harvardartmuseums.org/manifests/object/70504', 'type': 'IIIF Manifest', 'format': 'application/json', 'profile': 'http://iiif.io/api/presentation/2/context.json'}]",
18,2000.0,Etching,0,,497,1,"[{'alphasort': 'Velde, Jan van de II', 'birthplace': 'Rotterdam(?), Netherlands', 'name': 'Jan van de Velde II', 'prefix': None, 'personid': 29190, 'gender': 'male', 'role': 'Artist', 'displayorder': 1, 'culture': 'Dutch', 'displaydate': '1593 - 1641', 'deathplace': 'Enkhuizen, Netherlands', 'displayname': 'Jan van de Velde II'}]",M24774,7,2020-02-20T05:40:03-0500,19,1,,2020-02-11,2009-09-17,https://nrs.harvard.edu/urn-3:HUAM:INV162750_dynmc,"[{'percent': 0.26919540229885, 'spectrum': '#e66c64', 'color': '#c8af96', 'css3': '#d2b48c', 'hue': 'Brown'}, {'percent': 0.1632183908046, 'spectrum': '#59ba4a', 'color': '#644b32', 'css3': '#556b2f', 'hue': 'Brown'}, {'percent': 0.14942528735632, 'spectrum': '#b55592', 'color': '#c8c8af', 'css3': '#c0c0c0', 'hue': 'Green'}, {'percent': 0.13298850574713, 'spectrum': '#c25687', 'color': '#af967d', 'css3': '#bc8f8f', 'hue': 'Brown'}, {'percent': 0.12551724137931, 'spectrum': '#b25593', 'color': '#7d644b', 'css3': '#696969', 'hue': 'Yellow'}, {'percent': 0.10793103448276, 'spectrum': '#b65590', 'color': '#967d64', 'css3': '#808080', 'hue': 'Brown'}, {'percent': 0.051724137931034, 'spectrum': '#3db657', 'color': '#323219', 'css3': '#2f4f4f', 'hue': 'Brown'}]",1615,0,,,Purchase,https://www.harvardartmuseums.org/collections/object/197886,,"[{'height': 996, 'iiifbaseuri': 'https://ids.lib.harvard.edu/ids/iiif/20424985', 'baseimageurl': 'https://nrs.harvard.edu/urn-3:HUAM:INV162750_dynmc', 'width': 2550, 'publiccaption': None, 'idsid': 20424985, 'displayorder': 1, 'format': 'image/jpeg', 'copyright': 'President and Fellows of Harvard College', 'imageid': 271612, 'renditionnumber': 'INV162750'}]",0,197886,Dutch,Good. Object is well described and information is vetted,"H. 180, Fr.-v.d.K. 219","[{'worktypeid': '278', 'worktype': 'print'}]",Department of Prints,ii/ii,0,am_europeanamerican@harvard.edu,2,197886,The Temple of the Sibyl at Tivoli,3,European and American Art,,,0,1615,,429,plate: 11.9 x 31 cm (4 11/16 x 12 3/16 in.),2,116.0,1615,"Harvard Art Museums/Fogg Museum, Light-Outerbridge Collection, Richard Norton Memorial Fund",0,,,17th century,23,,1,1,Prints,"[{'id': 'https://iiif.harvardartmuseums.org/manifests/object/197886', 'type': 'IIIF Manifest', 'format': 'application/json', 'profile': 'http://iiif.io/api/presentation/2/context.json'}]",
19,2005.0,Chiaroscuro woodcut,0,,534,2,"[{'alphasort': 'Goltzius, Hendrick', 'birthplace': 'Mühlbracht', 'name': 'Hendrick Goltzius', 'prefix': None, 'personid': 22794, 'gender': 'male', 'role': 'Artist', 'displayorder': 1, 'culture': 'Dutch', 'displaydate': '1558 - 1617', 'deathplace': 'Haarlem, Netherlands', 'displayname': 'Hendrick Goltzius'}]",M26576,9,2020-02-20T05:36:52-0500,20,1,,2020-02-11,2009-06-09,https://nrs.harvard.edu/urn-3:HUAM:DDC100022_dynmc,"[{'percent': 0.2345197740113, 'spectrum': '#84c441', 'color': '#969664', 'css3': '#808080', 'hue': 'Green'}, {'percent': 0.21463276836158, 'spectrum': '#59ba4a', 'color': '#646432', 'css3': '#556b2f', 'hue': 'Green'}, {'percent': 0.1954802259887, 'spectrum': '#6cbd45', 'color': '#7d7d4b', 'css3': '#696969', 'hue': 'Green'}, {'percent': 0.17361581920904, 'spectrum': '#4ab851', 'color': '#4b4b32', 'css3': '#556b2f', 'hue': 'Green'}, {'percent': 0.094745762711864, 'spectrum': '#e9715f', 'color': '#c8af7d', 'css3': '#d2b48c', 'hue': 'Brown'}, {'percent': 0.037514124293785, 'spectrum': '#2eb45d', 'color': '#323232', 'css3': '#2f4f4f', 'hue': 'Grey'}, {'percent': 0.027457627118644, 'spectrum': '#a9cf38', 'color': '#c8c896', 'css3': '#d2b48c', 'hue': 'Green'}, {'percent': 0.012768361581921, 'spectrum': '#e9715f', 'color': '#e1e1c8', 'css3': '#dcdcdc', 'hue': 'Green'}, {'percent': 0.0092655367231638, 'spectrum': '#e9715f', 'color': '#e1c8af', 'css3': '#f5deb3', 'hue': 'Orange'}]",c.1597-1600,0,,,Purchase,https://www.harvardartmuseums.org/collections/object/55029,"Ed. Schultze, Vienna (906).
E. Fabricius, Berlin (847a, 919ter).
A. L. Blum, Switzerland and Short Hills, NJ (79b (var.)).
Samuel Josefowitz, Lucerne.
","[{'height': 2018, 'iiifbaseuri': 'https://ids.lib.harvard.edu/ids/iiif/18737572', 'baseimageurl': 'https://nrs.harvard.edu/urn-3:HUAM:DDC100022_dynmc', 'width': 2550, 'publiccaption': None, 'idsid': 18737572, 'displayorder': 1, 'format': 'image/jpeg', 'copyright': 'President and Fellows of Harvard College', 'imageid': 187387, 'renditionnumber': 'DDC100022'}]",0,55029,Dutch,Good. Object is well described and information is vetted,"New Hollstein 309, Hollstein 380, Bartsch 244, Bialler 51","[{'worktypeid': '278', 'worktype': 'print'}]",Department of Prints,ii/ii,7,am_europeanamerican@harvard.edu,3,55029,Landscape with a Farmhouse,3,European and American Art,,,0,1597,,475,blocks: 11.7 × 14.7 cm (4 5/8 × 5 13/16 in.),0,848.0,1600,"Harvard Art Museums/Fogg Museum, Light-Outerbridge Collection, Gift of Robert M. Light and Acquisition Fund for Prints",0,,,16th century,23,"Chiaroscuro woodcut: three blocks printed in black, dark green, and light green on white antique laid paper darkened to cream",1,1,Prints,"[{'id': 'https://iiif.harvardartmuseums.org/manifests/object/55029', 'type': 'IIIF Manifest', 'format': 'application/json', 'profile': 'http://iiif.io/api/presentation/2/context.json'}]",
